{
  "$schema": "https://json-schema.org/draft/2020-12/schema",
  "$id": "https://github.com/SecPal/.github/docs/schemas/secpal-vulnerability-evaluation-v1.schema.json",
  "title": "SecPal vulnerability policy evaluation input v1",
  "type": "object",
  "additionalProperties": false,
  "required": ["schema_version", "subject", "syft", "scanner_runs", "observations", "evaluated_at"],
  "properties": {
    "schema_version": { "const": "1.0.0" },
    "evaluated_at": { "type": "string", "format": "date-time" },
    "subject": { "$ref": "#/$defs/subject" },
    "syft": { "$ref": "#/$defs/syft" },
    "scanner_runs": {
      "type": "array",
      "items": { "$ref": "#/$defs/scanner_run" }
    },
    "observations": {
      "type": "array",
      "items": { "$ref": "#/$defs/observation" }
    }
  },
  "$defs": {
    "digest": { "type": "string", "pattern": "^sha256:[a-f0-9]{64}$" },
    "subject": {
      "type": "object",
      "additionalProperties": false,
      "required": ["oci_digest", "platform"],
      "properties": {
        "oci_digest": { "$ref": "#/$defs/digest" },
        "platform": {
          "type": "string",
          "pattern": "^[a-z0-9]+/[a-z0-9_]+(?:/[a-z0-9_.-]+)?$"
        }
      }
    },
    "syft": {
      "type": "object",
      "additionalProperties": false,
      "required": ["format", "spdx_digest", "subject_digest"],
      "properties": {
        "format": { "const": "SPDX" },
        "spdx_digest": { "$ref": "#/$defs/digest" },
        "subject_digest": { "$ref": "#/$defs/digest" }
      }
    },
    "scanner_identity": {
      "type": "object",
      "additionalProperties": false,
      "required": ["version", "immutable_id"],
      "properties": {
        "version": { "type": "string", "minLength": 1 },
        "immutable_id": { "type": "string", "minLength": 1 }
      }
    },
    "database": {
      "type": "object",
      "additionalProperties": false,
      "required": ["identity", "generated_at"],
      "properties": {
        "identity": { "type": "string", "minLength": 1 },
        "generated_at": { "type": "string", "format": "date-time" }
      }
    },
    "scanner_run": {
      "type": "object",
      "additionalProperties": false,
      "required": [
        "scanner",
        "run_id",
        "scanner_identity",
        "database",
        "subject",
        "status",
        "completed_at"
      ],
      "properties": {
        "scanner": { "enum": ["grype", "trivy"] },
        "run_id": { "type": "string", "minLength": 1 },
        "scanner_identity": { "$ref": "#/$defs/scanner_identity" },
        "database": { "$ref": "#/$defs/database" },
        "subject": { "$ref": "#/$defs/subject" },
        "status": { "enum": ["SUCCEEDED", "FAILED"] },
        "failure_reason": { "type": "string", "minLength": 1 },
        "completed_at": { "type": "string", "format": "date-time" }
      },
      "allOf": [
        {
          "if": { "properties": { "status": { "const": "FAILED" } } },
          "then": { "required": ["failure_reason"] }
        }
      ]
    },
    "component": {
      "type": "object",
      "additionalProperties": false,
      "required": ["name", "version"],
      "properties": {
        "name": { "type": "string", "minLength": 1 },
        "version": { "type": "string", "minLength": 1 },
        "purl": { "type": "string", "pattern": "^pkg:[^\\s]+$" }
      }
    },
    "vulnerability": {
      "type": "object",
      "additionalProperties": false,
      "required": ["id", "aliases"],
      "properties": {
        "id": { "type": "string", "pattern": "^\\S(?:.*\\S)?$" },
        "aliases": {
          "type": "array",
          "uniqueItems": true,
          "items": { "type": "string", "pattern": "^\\S(?:.*\\S)?$" }
        }
      }
    },
    "known_exploited": {
      "type": "object",
      "additionalProperties": false,
      "required": ["authority", "source", "identity", "captured_at", "matched_vulnerability"],
      "properties": {
        "authority": { "type": "string", "minLength": 1 },
        "source": { "type": "string", "minLength": 1 },
        "identity": { "type": "string", "minLength": 1 },
        "captured_at": { "type": "string", "format": "date-time" },
        "matched_vulnerability": { "type": "string", "minLength": 1 }
      }
    },
    "observation": {
      "type": "object",
      "additionalProperties": false,
      "required": [
        "scanner",
        "scanner_run_id",
        "subject",
        "component",
        "vulnerability",
        "severity",
        "fix",
        "match",
        "known_exploited",
        "observed_at"
      ],
      "properties": {
        "scanner": { "enum": ["grype", "trivy"] },
        "scanner_run_id": { "type": "string", "minLength": 1 },
        "subject": { "$ref": "#/$defs/subject" },
        "component": { "$ref": "#/$defs/component" },
        "vulnerability": { "$ref": "#/$defs/vulnerability" },
        "severity": { "enum": ["UNKNOWN", "LOW", "MEDIUM", "HIGH", "CRITICAL"] },
        "fix": {
          "type": "object",
          "additionalProperties": false,
          "required": ["state", "versions"],
          "properties": {
            "state": { "enum": ["fixed", "not_fixed", "unknown"] },
            "versions": {
              "type": "array",
              "uniqueItems": true,
              "items": { "type": "string", "minLength": 1 }
            }
          }
        },
        "match": {
          "type": "object",
          "additionalProperties": false,
          "required": ["confidence", "details"],
          "properties": {
            "confidence": { "type": "string", "minLength": 1 },
            "type": { "type": "string", "minLength": 1 },
            "location": { "type": "string", "minLength": 1 },
            "details": {
              "type": "array",
              "items": { "type": "string", "minLength": 1 }
            }
          }
        },
        "known_exploited": {
          "type": "array",
          "uniqueItems": true,
          "items": { "$ref": "#/$defs/known_exploited" }
        },
        "observed_at": { "type": "string", "format": "date-time" }
      }
    }
  }
}
