{
  "schema_version": "1.0.0",
  "subject": {
    "oci_digest": "sha256:aaaaaaaaaaaaaaaaaaaaaaaaaaaaaaaaaaaaaaaaaaaaaaaaaaaaaaaaaaaaaaaa",
    "platform": "linux/amd64"
  },
  "syft": {
    "format": "SPDX",
    "spdx_digest": "sha256:bbbbbbbbbbbbbbbbbbbbbbbbbbbbbbbbbbbbbbbbbbbbbbbbbbbbbbbbbbbbbbbb",
    "subject_digest": "sha256:aaaaaaaaaaaaaaaaaaaaaaaaaaaaaaaaaaaaaaaaaaaaaaaaaaaaaaaaaaaaaaaa"
  },
  "scanner_runs": [
    {
      "scanner": "grype",
      "run_id": "grype-run-1",
      "scanner_identity": {
        "version": "1.0.0",
        "immutable_id": "sha256:cccccccccccccccccccccccccccccccccccccccccccccccccccccccccccccccc"
      },
      "database": {
        "identity": "db-2026-08-23",
        "generated_at": "2026-08-23T00:00:00Z"
      },
      "subject": {
        "oci_digest": "sha256:aaaaaaaaaaaaaaaaaaaaaaaaaaaaaaaaaaaaaaaaaaaaaaaaaaaaaaaaaaaaaaaa",
        "platform": "linux/amd64"
      },
      "status": "SUCCEEDED",
      "completed_at": "2026-08-23T01:00:00Z"
    },
    {
      "scanner": "trivy",
      "run_id": "trivy-run-1",
      "scanner_identity": {
        "version": "1.0.0",
        "immutable_id": "sha256:dddddddddddddddddddddddddddddddddddddddddddddddddddddddddddddddd"
      },
      "database": {
        "identity": "db-2026-08-23",
        "generated_at": "2026-08-23T00:00:00Z"
      },
      "subject": {
        "oci_digest": "sha256:aaaaaaaaaaaaaaaaaaaaaaaaaaaaaaaaaaaaaaaaaaaaaaaaaaaaaaaaaaaaaaaa",
        "platform": "linux/amd64"
      },
      "status": "SUCCEEDED",
      "completed_at": "2026-08-23T01:00:00Z"
    }
  ],
  "observations": [],
  "evaluated_at": "2026-08-23T02:00:00Z"
}
